name,upfrontCost,annualSaving,paybackYears,deliveryYear
AI-enabled contact centre triage and CRM optimisation,3800,1450,3,1
Adult social care digital reablement pathway,4200,1725,3,1
Children's placement sufficiency and commissioning platform,2600,920,3,2
Asset energy retrofit and smart building controls,5100,1650,4,1
Fleet electrification and route optimisation,2900,980,3,2
Back-office automation for finance and procurement,3400,1280,3,1
Revenue and benefits digital verification,1800,640,3,2
Integrated case management and records rationalisation,2400,890,3,1
